{
  "report_format_version": "1.0",
  "execution_subject": {
    "kind": "reference_corpus",
    "implementation_id": "aicp-reference-corpus",
    "implementation_version": "0.1.0-rc.1",
    "implementation_digest": "sha256:51f5fb54112a03c97b620a62f8544594a0b89714e9a9d37389b443d357e3b9c3"
  },
  "runner": {
    "name": "aicp-conformance-runner",
    "version": "1.0",
    "source_revision": "sha256:4cd1869f6ae6876b0f4b5628961a097024fe02a3290408895f22ce3df3812a0a"
  },
  "suite": {
    "suite_id": "AUTH-AUTHENTICATED-MESSAGES-0.1",
    "suite_version": "0.1.0-experimental",
    "suite_digest": "sha256:b24849f465ea3690e99a8e1cb99ea5a1c893ef0239ca8f40d326c3d608f5f0a4"
  },
  "input_artifacts": [
    {
      "artifact_id": "AB-01",
      "path": "fixtures/security/authenticated_base/AB-01_valid_sender_signed.jsonl",
      "content_digest": "sha256:9e4981057f50a505c0698a2f45a1c059961bf894099662990bb5091d94f3ac0b"
    },
    {
      "artifact_id": "AB-02",
      "path": "fixtures/security/authenticated_base/AB-02_valid_multiple_signatures.jsonl",
      "content_digest": "sha256:d75516ba0174605c6bd7767a55443cd60b87ebb68a9964afe5ee71f069ef0eb3"
    },
    {
      "artifact_id": "AB-03",
      "path": "fixtures/security/authenticated_base/AB-03_unsigned_expected_fail.jsonl",
      "content_digest": "sha256:f63f0fde3af449c89644766f20c9358180f579e3a931610a7bc5a1f188cff88e"
    },
    {
      "artifact_id": "AB-04",
      "path": "fixtures/security/authenticated_base/AB-04_empty_signatures_expected_fail.jsonl",
      "content_digest": "sha256:d19b7fd26538e46a106d8356ed26c17cc98828d76994f7d57b7d131d442161eb"
    },
    {
      "artifact_id": "AB-05",
      "path": "fixtures/security/authenticated_base/AB-05_missing_message_hash_expected_fail.jsonl",
      "content_digest": "sha256:97d897e66e947f9ca97fc03126af4b9052362ebc3502146a8c9b7a4b492a5274"
    },
    {
      "artifact_id": "AB-06",
      "path": "fixtures/security/authenticated_base/AB-06_stale_message_hash_expected_fail.jsonl",
      "content_digest": "sha256:5f26f88cca39265e004651a36631aa95fc235d675e21948863352b6ab3e2c2cc"
    },
    {
      "artifact_id": "AB-07",
      "path": "fixtures/security/authenticated_base/AB-07_signature_object_hash_mismatch_expected_fail.jsonl",
      "content_digest": "sha256:0cfbc9501f188f0e405fce5a42b33a583e136505d3e23652603e1998d9a51933"
    },
    {
      "artifact_id": "AB-08",
      "path": "fixtures/security/authenticated_base/AB-08_signature_object_type_expected_fail.jsonl",
      "content_digest": "sha256:eed31078fe639985534d5c1ea9d49a5cba6f242c67e1aa445e9b92ea67da893b"
    },
    {
      "artifact_id": "AB-09",
      "path": "fixtures/security/authenticated_base/AB-09_no_sender_signature_expected_fail.jsonl",
      "content_digest": "sha256:30fa48424217d4ec59a4fd3639fbf666b6ab04a9fe91d3087b83fdbd8c092652"
    },
    {
      "artifact_id": "AB-10",
      "path": "fixtures/security/authenticated_base/AB-10_kid_mismatch_expected_fail.jsonl",
      "content_digest": "sha256:38aac4ebb16a6f194b38eaabda672de8954e391d060823e874e501ae62199524"
    },
    {
      "artifact_id": "AB-11",
      "path": "fixtures/security/authenticated_base/AB-11_unknown_signer_key_expected_fail.jsonl",
      "content_digest": "sha256:a6cc5225f19ce248ef3364dd396a6e5a039651f805f5d100c908265bcce636e9"
    },
    {
      "artifact_id": "AB-12",
      "path": "fixtures/security/authenticated_base/AB-12_invalid_signature_expected_fail.jsonl",
      "content_digest": "sha256:60f179309bfe21cfa22069e85208193f0d1ea56f7d5f55ad4a184bab91853166"
    },
    {
      "artifact_id": "AB-13",
      "path": "fixtures/security/authenticated_base/AB-13_copied_signature_expected_fail.jsonl",
      "content_digest": "sha256:4137d86993f37dfed2bd9209afe97d32c75ecaa812c261434eda0394a7e73ab7"
    },
    {
      "artifact_id": "AB-14",
      "path": "fixtures/security/authenticated_base/AB-14_invalid_signature_among_valid_expected_fail.jsonl",
      "content_digest": "sha256:36e8f52bfa3aa27704235cbf6304122f2bf2bb9921984371ab38ba9f0a194395"
    }
  ],
  "generated_artifacts": [],
  "aicp_version": "0.1",
  "suite_id": "AUTH-AUTHENTICATED-MESSAGES-0.1",
  "suite_version": "0.1.0-experimental",
  "timestamp": "2026-07-22T12:47:32.849497+00:00",
  "passed": true,
  "failures": [],
  "compatibility_marks": [
    "AICP-Security-AUTHENTICATED-MESSAGES-0.1"
  ],
  "degraded": false,
  "degraded_reasons": [],
  "skipped_checks": []
}
